{
  "schemaVersion": 1,
  "generatedAt": "2026-08-11T20:30:00+05:00",
  "scope": {
    "regions": 17,
    "citiesOfRepublicanSignificance": 3
  },
  "national": {
    "population": 20495974,
    "populationPeriod": "2026-01-01",
    "populationPrevious": 20286084,
    "populationPreviousPeriod": "2025-01-01",
    "annualChangePct": 1.03,
    "averageMonthlyWage": 461486,
    "averageMonthlyWagePeriod": "2026-Q1",
    "medianMonthlyWage": 331527,
    "higherEducationStudents": 678114,
    "higherEducationInstitutions": 116,
    "higherEducationPeriod": "2025-2026"
  },
  "sources": {
    "population": "https://stat.gov.kz/en/industries/social-statistics/demography/publications/475783/",
    "populationPrevious": "https://stat.gov.kz/en/industries/social-statistics/demography/publications/312581/",
    "wages": "https://stat.gov.kz/en/industries/labor-and-income/stat-wags/publications/484153/",
    "higherEducation": "https://stat.gov.kz/en/industries/social-statistics/stat-edu-science-inno/publications/470854/"
  },
  "mapSource": {
    "name": "Kazakhstan Regions Map (2024)",
    "url": "https://github.com/galymorg/new_qazaqstan_GeoJSON",
    "license": "MIT License",
    "licenseUrl": "https://github.com/galymorg/new_qazaqstan_GeoJSON/blob/main/LICENSE",
    "note": "Administrative geometry includes Abay, Zhetisu and Ulytau; city marker coordinates are projected from OpenStreetMap/Nominatim geocodes."
  },
  "items": [
    {
      "id": "abay",
      "type": "region",
      "nameZh": "阿拜州",
      "nameOriginal": "Абай облысы",
      "administrativeCenter": {
        "nameZh": "塞梅伊",
        "nameLatin": "Semey"
      },
      "population": {
        "value": 595676,
        "unit": "people",
        "period": "2026-01-01",
        "sourceUrl": "https://stat.gov.kz/en/industries/social-statistics/demography/publications/475783/",
        "previousValue": 602882,
        "previousPeriod": "2025-01-01",
        "previousSourceUrl": "https://stat.gov.kz/en/industries/social-statistics/demography/publications/312581/",
        "annualChangePct": -1.2,
        "urbanSharePct": 62.9
      },
      "averageMonthlyWage": {
        "value": 405425,
        "unit": "KZT/month",
        "period": "2026-Q1",
        "coverage": "Excludes small enterprises engaged in entrepreneurial activity",
        "sourceUrl": "https://stat.gov.kz/en/industries/labor-and-income/stat-wags/publications/484153/"
      },
      "higherEducation": {
        "kind": "talent-pool-proxy",
        "institutions": 3,
        "students": 18751,
        "period": "2025-2026",
        "noteZh": "高校数量与在校生规模用于观察本地人才池，不代表居民学历比例。",
        "sourceUrl": "https://stat.gov.kz/en/industries/social-statistics/stat-edu-science-inno/publications/470854/"
      },
      "resources": ["煤炭", "铜及有色金属", "农业原料"],
      "promisingSectors": ["矿业与冶金配套", "农产品加工", "工业设备维护"],
      "editorialNoteZh": "行业方向为基于公开资源禀赋、产业基础和区位条件的编辑判断，项目可行性仍需专项调研。",
      "investmentProfileUrl": "https://abai.invest.gov.kz/",
      "map": {
        "pcode": "KZ10",
        "path": "M 487.6 186.2 L 482.2 180.2 L 475.6 181.6 L 474.7 179.8 L 467.3 176.3 L 465.3 179.6 L 463.2 177.7 L 461.3 180.4 L 453.7 180.8 L 452.3 183.4 L 446.3 180.1 L 447.5 176.4 L 450.4 176.5 L 448.3 171.2 L 451.1 164.1 L 450.2 163.0 L 452.7 161.7 L 448.1 159.7 L 449.8 157.6 L 446.9 157.7 L 444.7 155.4 L 450.5 150.2 L 450.7 146.9 L 450.0 145.2 L 444.2 146.7 L 443.0 142.5 L 445.7 141.5 L 438.0 134.6 L 438.1 133.3 L 444.9 129.7 L 446.2 126.5 L 445.7 121.9 L 449.4 120.2 L 452.4 115.3 L 460.5 117.8 L 464.6 117.0 L 467.2 111.2 L 465.2 108.2 L 465.0 103.4 L 462.2 104.1 L 461.8 101.8 L 458.1 99.7 L 455.5 95.4 L 464.2 90.0 L 463.0 87.1 L 466.0 86.7 L 466.8 83.6 L 470.4 80.6 L 483.2 99.5 L 482.8 97.5 L 484.5 97.6 L 484.3 96.0 L 487.8 94.0 L 486.6 89.1 L 489.0 88.7 L 489.4 86.4 L 495.2 88.4 L 496.0 87.5 L 496.1 93.3 L 500.4 91.8 L 501.8 96.4 L 504.1 96.2 L 506.8 100.9 L 507.3 107.1 L 502.2 105.8 L 502.8 107.8 L 500.2 107.9 L 499.6 109.9 L 503.1 110.3 L 503.3 113.6 L 508.4 114.9 L 509.2 118.9 L 513.3 121.0 L 515.4 124.1 L 519.8 125.9 L 520.8 124.7 L 523.2 127.2 L 524.9 126.5 L 525.8 130.6 L 529.3 132.0 L 528.3 135.8 L 529.7 135.8 L 529.3 134.4 L 530.4 136.3 L 533.4 135.0 L 531.7 138.1 L 533.3 138.1 L 533.6 136.7 L 541.5 141.9 L 534.0 153.1 L 534.7 156.5 L 539.5 162.4 L 539.7 167.3 L 537.7 168.7 L 532.9 206.6 L 531.0 206.5 L 529.8 202.3 L 525.0 195.7 L 518.8 191.3 L 519.2 189.1 L 518.4 190.1 L 512.3 188.0 L 507.6 188.5 L 494.3 182.8 L 487.6 186.2 Z",
        "centerX": 490.7,
        "centerY": 144.8,
        "markerX": 505.0,
        "markerY": 110.9
      }
    },
    {
      "id": "akmola",
      "type": "region",
      "nameZh": "阿克莫拉州",
      "nameOriginal": "Ақмола облысы",
      "administrativeCenter": {
        "nameZh": "科克舍套",
        "nameLatin": "Kokshetau"
      },
      "population": {
        "value": 789413,
        "unit": "people",
        "period": "2026-01-01",
        "sourceUrl": "https://stat.gov.kz/en/industries/social-statistics/demography/publications/475783/",
        "previousValue": 787778,
        "previousPeriod": "2025-01-01",
        "previousSourceUrl": "https://stat.gov.kz/en/industries/social-statistics/demography/publications/312581/",
        "annualChangePct": 0.21,
        "urbanSharePct": 57.9
      },
      "averageMonthlyWage": {
        "value": 378763,
        "unit": "KZT/month",
        "period": "2026-Q1",
        "coverage": "Excludes small enterprises engaged in entrepreneurial activity",
        "sourceUrl": "https://stat.gov.kz/en/industries/labor-and-income/stat-wags/publications/484153/"
      },
      "higherEducation": {
        "kind": "talent-pool-proxy",
        "institutions": 4,
        "students": 12616,
        "period": "2025-2026",
        "noteZh": "高校数量与在校生规模用于观察本地人才池，不代表居民学历比例。",
        "sourceUrl": "https://stat.gov.kz/en/industries/social-statistics/stat-edu-science-inno/publications/470854/"
      },
      "resources": ["粮食", "黄金", "畜牧业"],
      "promisingSectors": ["粮油深加工", "矿业服务", "农业机械与仓储"],
      "editorialNoteZh": "行业方向为基于公开资源禀赋、产业基础和区位条件的编辑判断，项目可行性仍需专项调研。",
      "investmentProfileUrl": "https://akmola.invest.gov.kz/",
      "map": {
        "pcode": "KZ11",
        "path": "M 357.4 116.9 L 356.4 121.6 L 355.3 119.9 L 352.3 121.3 L 352.8 124.3 L 348.1 126.4 L 347.2 124.4 L 348.5 122.6 L 347.0 121.0 L 340.1 122.5 L 340.4 120.7 L 337.6 118.5 L 335.7 119.5 L 336.2 121.0 L 334.0 121.2 L 334.1 123.3 L 327.4 122.4 L 329.7 109.8 L 325.5 109.9 L 320.3 113.5 L 316.3 112.7 L 317.3 115.2 L 315.6 116.4 L 306.4 119.1 L 304.5 116.1 L 306.1 115.2 L 305.3 112.9 L 300.8 113.4 L 294.6 111.6 L 294.0 108.7 L 291.8 109.1 L 291.4 107.0 L 289.0 105.4 L 288.1 108.2 L 285.4 108.4 L 286.0 103.1 L 283.1 98.0 L 285.0 96.4 L 285.7 92.6 L 282.5 87.6 L 288.2 86.2 L 291.3 79.1 L 291.6 73.9 L 293.7 74.1 L 294.6 76.5 L 299.1 75.4 L 299.2 77.4 L 309.6 79.0 L 309.6 74.5 L 312.5 74.4 L 316.9 77.8 L 319.9 74.4 L 318.8 72.0 L 323.2 70.8 L 324.3 68.4 L 328.5 66.0 L 327.4 64.8 L 329.6 60.9 L 329.3 58.1 L 325.2 53.2 L 327.5 51.8 L 327.3 50.0 L 329.2 50.1 L 328.9 48.3 L 334.4 47.5 L 337.0 51.3 L 337.4 48.1 L 342.4 47.0 L 342.9 51.2 L 346.2 51.1 L 344.9 54.1 L 348.2 53.7 L 349.7 56.8 L 352.3 53.1 L 357.8 52.9 L 357.8 54.8 L 360.0 55.6 L 365.0 53.6 L 367.8 57.3 L 366.5 61.1 L 367.4 63.4 L 374.5 63.5 L 375.2 61.9 L 381.9 60.5 L 383.3 67.0 L 385.0 66.3 L 389.4 67.3 L 391.7 69.7 L 397.7 70.2 L 398.9 84.1 L 395.9 86.4 L 396.0 90.4 L 398.5 89.0 L 402.3 91.3 L 396.3 94.4 L 394.8 97.7 L 388.8 97.9 L 390.0 101.6 L 391.2 100.3 L 393.8 101.1 L 386.2 107.0 L 384.0 106.2 L 382.1 109.7 L 378.8 111.0 L 378.2 112.5 L 379.8 113.4 L 375.4 114.3 L 375.1 117.3 L 373.3 116.0 L 369.1 116.8 L 370.9 111.5 L 366.9 109.2 L 357.4 116.9 Z M 365.7 106.6 L 369.0 102.8 L 368.5 102.6 L 368.6 102.1 L 367.6 101.9 L 366.9 99.0 L 364.0 98.6 L 363.0 100.1 L 362.3 100.0 L 362.4 104.1 L 365.7 106.6 Z M 368.7 102.6 L 368.7 102.6 L 368.7 102.6 L 368.7 102.6 Z M 367.5 97.9 L 368.3 97.6 L 368.3 97.4 L 367.5 97.9 Z M 369.3 101.8 L 369.5 101.4 L 368.9 101.4 L 369.3 101.8 Z M 364.1 108.0 L 364.2 107.6 L 364.1 107.6 L 364.1 108.0 Z M 363.4 99.3 L 362.9 99.3 L 363.0 99.5 L 363.4 99.3 Z",
        "centerX": 343.6,
        "centerY": 88.3,
        "markerX": 331.3,
        "markerY": 57.6
      }
    },
    {
      "id": "aktobe",
      "type": "region",
      "nameZh": "阿克托别州",
      "nameOriginal": "Ақтөбе облысы",
      "administrativeCenter": {
        "nameZh": "阿克托别",
        "nameLatin": "Aktobe"
      },
      "population": {
        "value": 955775,
        "unit": "people",
        "period": "2026-01-01",
        "sourceUrl": "https://stat.gov.kz/en/industries/social-statistics/demography/publications/475783/",
        "previousValue": 949601,
        "previousPeriod": "2025-01-01",
        "previousSourceUrl": "https://stat.gov.kz/en/industries/social-statistics/demography/publications/312581/",
        "annualChangePct": 0.65,
        "urbanSharePct": 76.3
      },
      "averageMonthlyWage": {
        "value": 420239,
        "unit": "KZT/month",
        "period": "2026-Q1",
        "coverage": "Excludes small enterprises engaged in entrepreneurial activity",
        "sourceUrl": "https://stat.gov.kz/en/industries/labor-and-income/stat-wags/publications/484153/"
      },
      "higherEducation": {
        "kind": "talent-pool-proxy",
        "institutions": 5,
        "students": 24668,
        "period": "2025-2026",
        "noteZh": "高校数量与在校生规模用于观察本地人才池，不代表居民学历比例。",
        "sourceUrl": "https://stat.gov.kz/en/industries/social-statistics/stat-edu-science-inno/publications/470854/"
      },
      "resources": ["铬矿", "石油与天然气", "风能资源"],
      "promisingSectors": ["铬化工与冶金", "油气服务", "可再生能源设备"],
      "editorialNoteZh": "行业方向为基于公开资源禀赋、产业基础和区位条件的编辑判断，项目可行性仍需专项调研。",
      "investmentProfileUrl": "https://aktobe.invest.gov.kz/",
      "map": {
        "pcode": "KZ15",